287-305|Document explicit key/secret management,Encryption and Key Management Policy and Procedures,CEK-01,"Establish, document, approve, communicate, apply, evaluate and maintain policies and procedures for Cryptography, Encryption and Key Management. Review and update the policies and procedures at least annually or upon significant changes.",https://cloudsecurityalliance.org/artifacts/ai-controls-matrix
287-305|Document explicit key/secret management,Encryption Change Management,CEK-05,"Establish a standard change management procedure, to accommodate changes from internal and external sources, for review, approval, implementation and communication of cryptographic, encryption and key management technology changes.",https://cloudsecurityalliance.org/artifacts/ai-controls-matrix
287-305|Document explicit key/secret management,Encryption Change Cost Benefit Analysis,CEK-06,"Manage and adopt changes to cryptography-, encryption-, and key management-related systems (including policies and procedures) that fully account for downstream effects of proposed changes, including residual risk, cost, and benefits analysis.",https://cloudsecurityalliance.org/artifacts/ai-controls-matrix
287-305|Document explicit key/secret management,Encryption Risk Management,CEK-07,"Establish and maintain an encryption and key management risk program that includes provisions for risk assessment, risk treatment, risk context, monitoring, and feedback.",https://cloudsecurityalliance.org/artifacts/ai-controls-matrix
287-305|Document explicit key/secret management,Encryption and Key Management Audit,CEK-09,"Audit encryption and key management systems, policies, and processes with a frequency that is proportional to the risk exposure of the system with audit occurring preferably continuously but at least annually and after any security event(s).",https://cloudsecurityalliance.org/artifacts/ai-controls-matrix
287-305|Document explicit key/secret management,Key Inventory Management,CEK-21,"Define, implement and evaluate processes, procedures and technical measures in order for the key management system to track and report all cryptographic materials and changes in status, which include provisions for legal and regulatory requirements.",https://cloudsecurityalliance.org/artifacts/ai-controls-matrix
287-823|Asset management,Assets Classification,DCS-05,"Classify and document the physical, and logical assets (e.g., applications) based on the organizational business risk. Review and update the assets’ classification at least annually or upon significant changes.",https://cloudsecurityalliance.org/artifacts/ai-controls-matrix
287-823|Asset management,Assets Cataloguing and Tracking,DCS-06,Catalogue and track all relevant physical and logical assets located at all of the service providers sites within a secured system. Review and update the catalogue at least annually or upon significant changes.,https://cloudsecurityalliance.org/artifacts/ai-controls-matrix
287-823|Asset management,Data Inventory,DSP-03,"Create and maintain a data inventory, at least for any sensitive, regulated and personal data. Review and update the inventory at least annually or upon significant changes.",https://cloudsecurityalliance.org/artifacts/ai-controls-matrix
287-823|Asset management,Asset returns,HRS-05,Establish and document procedures for the return of organization-owned assets by terminated employees.,https://cloudsecurityalliance.org/artifacts/ai-controls-matrix
307-242|Security risk assessment,Risk Based Planning Assessment,A&A-03,Perform independent audit and assurance assessments in response to significant changes or emerging risks and according to risk-based plans and policies.,https://cloudsecurityalliance.org/artifacts/ai-controls-matrix
307-242|Security risk assessment,Risk Assessment and Impact Analysis,BCR-02,Determine the impact of business disruptions and risks to establish criteria for developing business continuity and operational resilience strategies and capabilities. Review and update the risk assessment and impact analysis at least annually or upon significant changes.,https://cloudsecurityalliance.org/artifacts/ai-controls-matrix
307-242|Security risk assessment,Risk Management Program,GRC-02,"Establish and maintain a formal, documented, and leadership-sponsored AI Risk Management (AIRM) program that includes policies and procedures for identification, evaluation, ownership, treatment, and acceptance of risks.",https://cloudsecurityalliance.org/artifacts/ai-controls-matrix
307-242|Security risk assessment,Open Model Risk Assessment,MDS-12,"Establish a process to evaluate risk associated with open models. Periodically review these risk factors, and implement a process to monitor and mitigate any determined vulnerabilities.",https://cloudsecurityalliance.org/artifacts/ai-controls-matrix
307-507|Allow only trusted sources both build time and runtime; therefore perform integrity checks on all resources and code,Model Signing/Ownership Verification,MDS-09,"Sign models cryptographically and verify signatures to ensure model provenance and ownership, any time the model changes hands or is loaded from storage.",https://cloudsecurityalliance.org/artifacts/ai-controls-matrix
333-480|Impact limitation of unwanted model behaviour,Guardrails,TVM-11,"Define and implement processes, procedures and technical measures to apply guardrails to the AI system. Continuously evaluate guardrails for changes in regulatory requirements and risk scenarios.",https://cloudsecurityalliance.org/artifacts/ai-controls-matrix
356-282|Minimize sensitive data scattering and retention,Clean Desk Policy and Procedures,HRS-03,"Establish, document, approve, communicate, apply, evaluate and maintain policies and procedures that require unattended workspaces to not have openly visible confidential data. Review and update the policies and procedures at least annually.",https://cloudsecurityalliance.org/artifacts/ai-controls-matrix
356-282|Minimize sensitive data scattering and retention,Data Loss Prevention,UEM-11,Configure managed endpoints with Data Loss Prevention (DLP) technologies and rules in accordance with a risk assessment.,https://cloudsecurityalliance.org/artifacts/ai-controls-matrix
362-550|Personal data handling,Data Protection Impact Assessment,DSP-09,"Conduct a Data Protection Impact Assessment (DPIA) to evaluate the origin, nature, particularity and severity of the risks upon the processing of personal data, according to any applicable laws, regulations and industry best practices.",https://cloudsecurityalliance.org/artifacts/ai-controls-matrix
362-550|Personal data handling,Personal Data Sub-processing,DSP-13,"Define, implement and evaluate processes, procedures and technical measures for the transfer and sub-processing of personal data within the service supply chain, according to any applicable laws and regulations.",https://cloudsecurityalliance.org/artifacts/ai-controls-matrix
402-706|Log relevant,Log Records,LOG-08,Generate audit records containing relevant security information.,https://cloudsecurityalliance.org/artifacts/ai-controls-matrix
402-706|Log relevant,Transaction/Activity Logging,LOG-11,Log and monitor key lifecycle management events to enable auditing and reporting on usage of cryptographic keys.,https://cloudsecurityalliance.org/artifacts/ai-controls-matrix
408-838|Adversarial training,Robustness against Adversarial Attack / Model Hardening,MDS-07,"Define, implement, and evaluate processes, procedures, and technical measures for Model Hardening to mitigate relevant adversarial attacks as identified in the Threat Analysis and Adversarial Threat Analysis.",https://cloudsecurityalliance.org/artifacts/ai-controls-matrix
423-055|Data supply chain management,Data Provenance and Transparency,DSP-20,"Define, implement and evaluate processes, procedures and technical measures to: 1) Document and trace data sources, and 2) Make the data source available according to legal and regulatory requirements",https://cloudsecurityalliance.org/artifacts/ai-controls-matrix
423-055|Data supply chain management,Supply Chain Data Security Assessment,STA-15,Define and implement a process for conducting security assessments periodically for all organizations within the supply chain.,https://cloudsecurityalliance.org/artifacts/ai-controls-matrix
428-544|Security awareness training,Adverse Event Response Training,DCS-11,"Train datacenter personnel to safely manage adverse events, including but not limited to unauthorized ingress and egress attempts.",https://cloudsecurityalliance.org/artifacts/ai-controls-matrix
428-544|Security awareness training,Security Awareness Training,HRS-11,"Establish, document, approve, communicate, apply, evaluate and maintain a security awareness training program for all employees of the organization and provide regular training updates.",https://cloudsecurityalliance.org/artifacts/ai-controls-matrix
428-544|Security awareness training,Personal and Sensitive Data Awareness and Training,HRS-12,"Provide employees with access to sensitive organizational and personal data with appropriate security awareness training and regular updates in organizational procedures, processes, and policies relating to their professional function relative to the organization.",https://cloudsecurityalliance.org/artifacts/ai-controls-matrix
435-702|Communication encryption,Sensitive Data Transfer,DSP-10,"Define, implement and evaluate processes, procedures and technical measures that ensure any transfer of personal or sensitive data is protected from unauthorized access and only processed within scope as permitted by the respective laws and regulations.",https://cloudsecurityalliance.org/artifacts/ai-controls-matrix
435-702|Communication encryption,Migration to Hosted Environments,I&S-07,"Use secure and encrypted communication channels when migrating servers, services, applications, or data to hosted environments. Such channels must include only up-to-date and approved protocols.",https://cloudsecurityalliance.org/artifacts/ai-controls-matrix
447-083|Privacy-preserving personal data logic,Data Protection by Design and Default,DSP-07,"Develop systems, products, and business practices based upon a principle of security by design and industry best practices.",https://cloudsecurityalliance.org/artifacts/ai-controls-matrix
447-083|Privacy-preserving personal data logic,Data Privacy by Design and Default,DSP-08,"Develop systems, products, and business practices based upon a principle of privacy by design and industry best practices. Ensure that systems' privacy settings are configured by default, according to all applicable laws and regulations.",https://cloudsecurityalliance.org/artifacts/ai-controls-matrix
447-083|Privacy-preserving personal data logic,Disclosure of Data Sub-processors,DSP-14,"Define, implement and evaluate processes, procedures and technical measures to disclose the details of any personal or sensitive data access by sub-processors to the data owner prior to initiation of that processing.",https://cloudsecurityalliance.org/artifacts/ai-controls-matrix
447-083|Privacy-preserving personal data logic,Privacy Enhancing Technologies,DSP-22,"Use Privacy Enhancing Technologies for training data, informed by risk and privacy impact analysis and business use cases.",https://cloudsecurityalliance.org/artifacts/ai-controls-matrix
455-885|Credentials directives,Strong Password Policy and Procedures,IAM-02,"Establish, document, approve, communicate, implement, apply, evaluate and maintain strong password policies and procedures. Review and update the policies and procedures at least annually.",https://cloudsecurityalliance.org/artifacts/ai-controls-matrix
463-577|Incident response,Disaster Response Plan,BCR-09,"Establish, document, approve, communicate, apply, evaluate and maintain a disaster response plan to recover from natural and man-made disasters. Update the plan at least annually or upon significant changes.",https://cloudsecurityalliance.org/artifacts/ai-controls-matrix
463-577|Incident response,Disclosure Notification,DSP-18,The providers should implement and describe to customers the procedure to manage and respond to requests for disclosure of Personal Data by Law Enforcement Authorities according to applicable laws and regulations.,https://cloudsecurityalliance.org/artifacts/ai-controls-matrix
463-577|Incident response,Security Incident Management Policy and Procedures,SEF-01,"Establish, document, approve, communicate, apply, evaluate and maintain policies and procedures for Security Incident Management, E-Discovery, and Forensics. Review and update the policies and procedures at least annually or upon significant changes.",https://cloudsecurityalliance.org/artifacts/ai-controls-matrix
463-577|Incident response,Incident Response Plans,SEF-03,"Establish, document, approve, communicate, apply, evaluate and maintain a security incident response plan, which includes but is not limited to: a communication strategy for notifying relevant internal departments, impacted AICs, and other business critical relationships (such as supply-chain) that may be impacted.",https://cloudsecurityalliance.org/artifacts/ai-controls-matrix
463-577|Incident response,Incident Response Testing,SEF-04,Follow a structured approach to evaluate the effectiveness of incident response plans at planned intervals or upon significant changes.,https://cloudsecurityalliance.org/artifacts/ai-controls-matrix
463-577|Incident response,Incident Response Metrics,SEF-05,"Establish, monitor and report information security incident metrics.",https://cloudsecurityalliance.org/artifacts/ai-controls-matrix
463-577|Incident response,Event Triage Processes,SEF-06,"Define, implement and evaluate processes, procedures and technical measures supporting business processes to triage security-related events.",https://cloudsecurityalliance.org/artifacts/ai-controls-matrix
463-577|Incident response,Security Breach Notification,SEF-07,"Define and implement, processes, procedures and technical measures for security breach notifications. Report material security breaches and assumed security breaches including any relevant supply chain breaches, as per applicable SLAs, laws and regulations.",https://cloudsecurityalliance.org/artifacts/ai-controls-matrix
463-577|Incident response,Points of Contact Maintenance,SEF-08,"Maintain points of contact for applicable regulation authorities, national and local law enforcement, and other legal jurisdictional authorities. Review and update the points of contact at least annually.",https://cloudsecurityalliance.org/artifacts/ai-controls-matrix
463-577|Incident response,Incident Response,SEF-09,"Define incident categories and severity levels for AI systems, and determine response procedures for each, including automated response where applicable.",https://cloudsecurityalliance.org/artifacts/ai-controls-matrix
467-784|Network security,Network Security,I&S-03,"Monitor, encrypt and restrict communications between environments to only authenticated and authorized connections, as justified by the business. Review these configurations at least annually, and support them by a documented justification of all allowed services, protocols, ports, and compensating controls.",https://cloudsecurityalliance.org/artifacts/ai-controls-matrix
486-813|Configuration,Detection of Baseline Deviation,CCC-07,Implement detection measures with proactive notification in case of changes deviating from the established baseline.,https://cloudsecurityalliance.org/artifacts/ai-controls-matrix
504-340|Encrypt sensitive data with algorithms that provide both confidentiality and integrity,Data Encryption,CEK-03,"Provide data protection at-rest, in-transit and, where applicable, in-use by using cryptographic libraries certified to approved standards.",https://cloudsecurityalliance.org/artifacts/ai-controls-matrix
504-340|Encrypt sensitive data with algorithms that provide both confidentiality and integrity,Storage Encryption,UEM-08,Protect information from unauthorized disclosure on managed endpoint devices with storage encryption.,https://cloudsecurityalliance.org/artifacts/ai-controls-matrix
510-324|Compliance,Supply Chain Service Agreement Compliance,STA-13,"Implement policies requiring all service providers throughout the supply chain to comply with information security, confidentiality, access control, privacy, audit, personnel policy and service level requirements and standards.",https://cloudsecurityalliance.org/artifacts/ai-controls-matrix
"515-021|Sandbox, containerize and/or isolate applications at the network level",Infrastructure and Virtualization Security Policy and Procedures,I&S-01,"Establish, document, approve, communicate, apply, evaluate and maintain policies and procedures for infrastructure and virtualization security. Review and update the policies and procedures at least annually, or upon significant changes.",https://cloudsecurityalliance.org/artifacts/ai-controls-matrix
522-616|Media protection,Secure Media Transportation Policy and Procedures,DCS-04,"Establish, document, approve, communicate, apply, evaluate and maintain policies and procedures for the secure transportation of physical media. Review and update the policies and procedures at least annually, or upon significant changes.",https://cloudsecurityalliance.org/artifacts/ai-controls-matrix
524-603|Limit modification of access controls to specifically authorized actors/users,Management of Privileged Access Roles,IAM-10,"Define and implement an access process to ensure privileged access roles and rights are granted for a time limited period, and implement procedures to prevent the accumulation of segregated privileged access.",https://cloudsecurityalliance.org/artifacts/ai-controls-matrix
524-603|Limit modification of access controls to specifically authorized actors/users,Customers' Approval for Agreed Privileged Access Roles,IAM-11,"Define, implement and evaluate processes and procedures for customers to participate, where applicable, in the granting of access for agreed, high risk (as defined by the organizational risk assessment) privileged access roles.",https://cloudsecurityalliance.org/artifacts/ai-controls-matrix
524-603|Limit modification of access controls to specifically authorized actors/users,Output Modification and Special Authorization,IAM-18,"When allowing model output modification of AI generated output, establish a role for this access and allow changes only by authorized identities.",https://cloudsecurityalliance.org/artifacts/ai-controls-matrix
533-635|AI security Education,AI Competency Training,HRS-14,"Establish, document, approve, communicate, apply, evaluate and maintain policies and procedures defining the AI training program for all relevant personnel of the organization based on their roles and provide regular training updates.",https://cloudsecurityalliance.org/artifacts/ai-controls-matrix
540-566|Let application request minimal permissions,Application and Service Approval,UEM-02,"Define, document, apply and evaluate a list of approved services, applications and sources of applications (stores) acceptable for use by endpoints when accessing or storing organization-managed data.",https://cloudsecurityalliance.org/artifacts/ai-controls-matrix
552-588|Detect and prevent unusual activity,Security Monitoring and Alerting,LOG-03,"Identify and monitor security-related events within applications, the underlying infrastructure, supply chain, and consider logging other events based on risk evaluation. Define and implement a system to generate alerts to responsible stakeholders based on such events and corresponding metrics.",https://cloudsecurityalliance.org/artifacts/ai-controls-matrix
552-588|Detect and prevent unusual activity,Failures and Anomalies Reporting,LOG-13,"Define, implement and evaluate processes, procedures and technical measures for the reporting of anomalies and failures of the monitoring system and provide immediate notification to the accountable party.",https://cloudsecurityalliance.org/artifacts/ai-controls-matrix
570-487|Manual penetration testing,Penetration Testing,TVM-06,"Define, implement and evaluate processes, procedures and technical measures for the periodic performance of penetration testing by independent third parties.",https://cloudsecurityalliance.org/artifacts/ai-controls-matrix
613-286|Dependency management,External Library Vulnerabilities,TVM-05,"Define, implement and evaluate processes, procedures and technical measures to identify updates for applications which use third party or open source libraries according to the organization's vulnerability management policy.",https://cloudsecurityalliance.org/artifacts/ai-controls-matrix
615-663|Data poisoning of train/finetune/augmentation data,Data Poisoning Prevention & Detection,DSP-21,"Define, implement and evaluate processes, procedures and technical measures to prevent data poisoning in AI models and continuously detect such.",https://cloudsecurityalliance.org/artifacts/ai-controls-matrix
646-285|AI compliance management,Requirements Compliance,A&A-04,"Verify compliance with all relevant standards, regulations, legal/contractual, and statutory requirements applicable to the audit.",https://cloudsecurityalliance.org/artifacts/ai-controls-matrix
646-285|AI compliance management,Information System Regulatory Mapping,GRC-07,"Identify and document all relevant standards, regulations, legal/contractual, and statutory requirements, which are applicable to your organization. Review at least annually or when a substantial change occurs within the organization.",https://cloudsecurityalliance.org/artifacts/ai-controls-matrix
703-813|Monitor inference,Input Monitoring,LOG-14,Log and monitor all input events (content and metadata) to enable auditing and reporting on the usage of AI models.,https://cloudsecurityalliance.org/artifacts/ai-controls-matrix
703-813|Monitor inference,Output Monitoring,LOG-15,Log and monitor all output events (content and metadata) to enable auditing and reporting on usage of AI models.,https://cloudsecurityalliance.org/artifacts/ai-controls-matrix
703-813|Monitor inference,Model Continuous Monitoring,MDS-10,"Define, implement, and evaluate processes, procedures, and technical measures for continuous monitoring of model performance metrics over time to identify sudden shifts or unexpected changes in predictions that could degrade model performance.",https://cloudsecurityalliance.org/artifacts/ai-controls-matrix
713-684|Log access protection,Audit Logs Protection,LOG-02,"Define, implement and evaluate processes, procedures and technical measures to ensure the security and retention of audit logs.",https://cloudsecurityalliance.org/artifacts/ai-controls-matrix
713-684|Log access protection,Audit Logs Access and Accountability,LOG-04,Restrict access to audit logs and maintain records of access to logs.,https://cloudsecurityalliance.org/artifacts/ai-controls-matrix
715-304|Zeroize sensitive information in memory after use,Secure Disposal,DSP-02,Apply industry accepted methods for the secure disposal of data from storage media such that data is not recoverable by any forensic means.,https://cloudsecurityalliance.org/artifacts/ai-controls-matrix
732-148|Vulnerability management,Application Vulnerability Remediation,AIS-07,"Define and implement a process to remediate application security vulnerabilities, automating remediation when possible.",https://cloudsecurityalliance.org/artifacts/ai-controls-matrix
732-148|Vulnerability management,Threat and Vulnerability Management Policy and Procedures,TVM-01,"Establish, document, approve, communicate, apply, evaluate and maintain policies and procedures to identify, report and prioritize the remediation of vulnerabilities and threats, in order to protect systems against vulnerability exploitation. Review and update the policies and procedures at least annually or upon significant changes.",https://cloudsecurityalliance.org/artifacts/ai-controls-matrix
732-148|Vulnerability management,Vulnerability Identification,TVM-03,"Define, implement and evaluate processes, procedures and technical measures to enable both scheduled and emergency responses to vulnerability identifications, based on the identified risk.",https://cloudsecurityalliance.org/artifacts/ai-controls-matrix
732-148|Vulnerability management,Detection Updates,TVM-04,"Define, implement and evaluate processes, procedures and technical measures to update detection tools, threat signatures, and indicators of compromise on a weekly, or more frequent basis.",https://cloudsecurityalliance.org/artifacts/ai-controls-matrix
732-148|Vulnerability management,Vulnerability Remediation Schedule,TVM-07,"Define, implement and evaluate processes, procedures and technical measures based on identified risks to support scheduled and emergency responses to vulnerability identification.",https://cloudsecurityalliance.org/artifacts/ai-controls-matrix
732-148|Vulnerability management,Vulnerability Prioritization,TVM-08,Use a risk-based model for effective prioritization of vulnerability remediation using an industry recognized framework.,https://cloudsecurityalliance.org/artifacts/ai-controls-matrix
732-148|Vulnerability management,Vulnerability Management Reporting,TVM-09,Define and implement a process for tracking and reporting vulnerability identification and remediation activities that includes stakeholder notification.,https://cloudsecurityalliance.org/artifacts/ai-controls-matrix
732-148|Vulnerability management,Vulnerability Management Metrics,TVM-10,"Establish, monitor and report metrics for vulnerability identification and remediation at defined intervals.",https://cloudsecurityalliance.org/artifacts/ai-controls-matrix
