CRE 0,CSA AI Controls Matrix|name,CSA AI Controls Matrix|id,CSA AI Controls Matrix|description,CSA AI Controls Matrix|hyperlink
004-517|Security requirements,Application Security Baseline Requirements,AIS-02,"Establish, document and maintain baseline requirements for securing applications.""",https://cloudsecurityalliance.org/artifacts/ai-controls-matrix
004-517|Security requirements,Primary Service and Contractual Agreement,STA-10,"Service agreements must incorporate at least the following mutually-agreed upon provisions and/or terms: • Scope, characteristics and location of business relationship and services offered • Information security requirements (including SSRM) • Change management process • Logging and monitoring capability • Incident management and communication procedures • Right to audit and third party assessment • Service termination • Interoperability and portability requirements • Data privacy",https://cloudsecurityalliance.org/artifacts/ai-controls-matrix
007-274|Patching and updating system components,Operating Systems,UEM-07,"Manage changes to endpoint operating systems, patch levels, and/or applications through the company's change management processes.",https://cloudsecurityalliance.org/artifacts/ai-controls-matrix
010-308|Input validation,Input Validation,AIS-08,"Validate, filter, modify or block, as necessary, input against adversarial patterns, failure patterns and unwanted behaviour according to organisational policies and applicable laws and regulations.",https://cloudsecurityalliance.org/artifacts/ai-controls-matrix
010-678|Improvement management,Remediation,A&A-06,"Establish, document, approve, communicate, apply, evaluate and maintain a risk-based corrective action plan to remediate audit findings, regularly review and report remediation status to relevant stakeholders.",https://cloudsecurityalliance.org/artifacts/ai-controls-matrix
013-021|Roles and responsibilities,CEK Roles and Responsibilities,CEK-02,"Define and implement cryptographic, encryption and key management roles and responsibilities.",https://cloudsecurityalliance.org/artifacts/ai-controls-matrix
013-021|Roles and responsibilities,Governance Responsibility Model,GRC-06,"Define and document roles and responsibilities for planning, implementing, operating, assessing, and improving governance programs.",https://cloudsecurityalliance.org/artifacts/ai-controls-matrix
013-021|Roles and responsibilities,Personnel Roles and Responsibilities,HRS-09,"Document and communicate roles and responsibilities of employees, as they relate to information assets and security.",https://cloudsecurityalliance.org/artifacts/ai-controls-matrix
013-021|Roles and responsibilities,Compliance User Responsibility,HRS-13,"Make employees aware of their roles and responsibilities for maintaining awareness and compliance with established policies and procedures and applicable legal, statutory, or regulatory compliance obligations.",https://cloudsecurityalliance.org/artifacts/ai-controls-matrix
013-021|Roles and responsibilities,SSRM Policy and Procedures,STA-02,"Establish, document, approve, communicate, apply, evaluate and maintain policies and procedures for the application of the Shared Security Responsibility Model (SSRM) within the organization. Review and update the policies and procedures at least annually, or upon significant changes.",https://cloudsecurityalliance.org/artifacts/ai-controls-matrix
013-021|Roles and responsibilities,SSRM Guidance,STA-04,Provide SSRM Guidance to the Customer detailing information about the SSRM applicability throughout the supply chain.,https://cloudsecurityalliance.org/artifacts/ai-controls-matrix
013-021|Roles and responsibilities,SSRM Control Ownership,STA-05,Delineate the shared ownership and applicability of all CSA AICM controls according to the SSRM.,https://cloudsecurityalliance.org/artifacts/ai-controls-matrix
013-021|Roles and responsibilities,SSRM Control Implementation,STA-07,"Implement, operate, and audit or assess the portions of the SSRM which the organization is responsible for.",https://cloudsecurityalliance.org/artifacts/ai-controls-matrix
041-188|Data quality control,Data Differentiation and Relevance,DSP-24,Ensure training-data differentiation and relevance to the intended use of the AI Model.,https://cloudsecurityalliance.org/artifacts/ai-controls-matrix
058-083|Monitoring,Application Security Metrics,AIS-03,"Define and implement technical and operational metrics in alignment with business objectives, security requirements, and compliance obligations.",https://cloudsecurityalliance.org/artifacts/ai-controls-matrix
058-083|Monitoring,Encryption Monitoring and Reporting,LOG-10,"Establish and maintain a monitoring and internal reporting capability over the operations of cryptographic, encryption and key management policies, processes, procedures, and controls.",https://cloudsecurityalliance.org/artifacts/ai-controls-matrix
065-782|Ensure session timeout (soft/hard),Automatic Lock Screen,UEM-06,Configure all relevant interactive-use endpoints to require an automatic lock screen.,https://cloudsecurityalliance.org/artifacts/ai-controls-matrix
068-102|Describe high-level system architecture and perform threat modeling on it every critical change and regularly,Network Architecture Documentation,I&S-08,Identify and document high-risk environments.,https://cloudsecurityalliance.org/artifacts/ai-controls-matrix
068-102|Describe high-level system architecture and perform threat modeling on it every critical change and regularly,Threat Analysis and Modelling,TVM-12,"Define implement and evaluate threat analysis process and procedures to identify, assess and review the threat landscape for Cloud and AI systems. Build threat models according to industry best practices to inform the risk mitigation strategy.",https://cloudsecurityalliance.org/artifacts/ai-controls-matrix
074-873|Data classification and handling,Security and Privacy Policy and Procedures,DSP-01,"Establish, document, approve, communicate, apply, evaluate and maintain policies and procedures for the classification, protection, preparation and handling of data throughout its lifecycle, and according to all applicable laws and regulations,standards, and risk level. Review and update the policies and procedures at least annually.",https://cloudsecurityalliance.org/artifacts/ai-controls-matrix
074-873|Data classification and handling,Data Ownership and Stewardship,DSP-06,Document ownership and stewardship of all relevant documented personal and sensitive data. Perform review at least annually.,https://cloudsecurityalliance.org/artifacts/ai-controls-matrix
088-316|Augmentation data integrity controls,Data Integrity Check,DSP-23,"Regularly validate the consistency and conformity of training, fine-tuning or augmentation data. Implement dataset versioning to ensure traceability and enforce restrictions to prevent unauthorized changes.",https://cloudsecurityalliance.org/artifacts/ai-controls-matrix
088-377|Automated dynamic security testing,Application Security Testing,AIS-05,"Implement a testing strategy, including criteria for acceptance of new information systems, upgrades and new versions, which provides application security assurance and maintains compliance while meeting organizational delivery goals. Automate when applicable and possible.",https://cloudsecurityalliance.org/artifacts/ai-controls-matrix
106-447|Prompt input segregation,Prompt Differentation,AIS-15,"Implement mechanisms enabling the model to clearly distinguish user-provided input instructions from data and system instructions (e.g., system prompts).",https://cloudsecurityalliance.org/artifacts/ai-controls-matrix
112-648|Change management,Change Management Policy and Procedures,CCC-01,"Establish, document, approve, communicate, apply, evaluate and maintain policies and procedures for managing the risks associated with applying changes to assets owned, controlled or used by the organization. Review and update the policies and procedures at least annually, or upon significant changes.",https://cloudsecurityalliance.org/artifacts/ai-controls-matrix
112-648|Change management,Change Management Technology,CCC-03,"Implement a change management procedure to manage the risks associated with applying changes to assets owned, controlled or used by the organization.",https://cloudsecurityalliance.org/artifacts/ai-controls-matrix
112-648|Change management,Change Authorization,CCC-04,"Implement and enforce a procedure to authorize addition, removal, update, and management of assets, owned, controlled or used by the organization.",https://cloudsecurityalliance.org/artifacts/ai-controls-matrix
112-648|Change management,Change Agreements,CCC-05,Include provisions limiting changes directly impacting customer owned environments/tenants to explicitly authorized requests within service level agreements.,https://cloudsecurityalliance.org/artifacts/ai-controls-matrix
112-648|Change management,Change Management Baseline,CCC-06,Establish change management baselines for all relevant authorized changes on organization assets. Review and update the change management baseline at least annually or upon significant changes.,https://cloudsecurityalliance.org/artifacts/ai-controls-matrix
112-648|Change management,Exception Management,CCC-08,"Implement a procedure for the management of exceptions, including emergencies, in the change and configuration process. Align the procedure with the requirements of GRC-04: Policy Exception Process.",https://cloudsecurityalliance.org/artifacts/ai-controls-matrix
118-110|API/web services,API Security,AIS-10,"Define and implement processes, procedures, and technical measures to secure APIs. Review and update for any improvements at least annually or after significant system changes.",https://cloudsecurityalliance.org/artifacts/ai-controls-matrix
118-110|API/web services,Application Interface Availability,IPY-02,Provide application interface(s) to AICs so that they programmatically retrieve their data to enable interoperability and portability.,https://cloudsecurityalliance.org/artifacts/ai-controls-matrix
123-124|Minimize permissions,Least Privilege,IAM-05,Employ the least privilege principle when implementing information system access.,https://cloudsecurityalliance.org/artifacts/ai-controls-matrix
128-128|Strong authorization checking,Authorization Mechanisms,IAM-16,"Define, implement and evaluate processes, procedures and technical measures to verify access to data and system functions is authorized.",https://cloudsecurityalliance.org/artifacts/ai-controls-matrix
"132-146|Apply defense-in-depth techniques/processes for protection, detection, and timely response to network-based attacks.",Network Defense,I&S-09,"Define, implement and evaluate processes, procedures and defense-in-depth techniques for protection, detection, and timely response to network-based attacks.",https://cloudsecurityalliance.org/artifacts/ai-controls-matrix
135-200|Review of security policies,Organizational Policy Reviews,GRC-03,Review all relevant organizational policies and associated procedures at least annually or when a substantial change occurs within the organization.,https://cloudsecurityalliance.org/artifacts/ai-controls-matrix
148-227|Endpoint management,Endpoint Devices Policy and Procedures,UEM-01,"Establish, document, approve, communicate, apply, evaluate and maintain policies and procedures for all endpoints. Review and update the policies and procedures at least annually or upon significant system changes.",https://cloudsecurityalliance.org/artifacts/ai-controls-matrix
148-227|Endpoint management,Compatibility,UEM-03,Define and implement a process for the validation of the endpoint device's compatibility with operating systems and applications.,https://cloudsecurityalliance.org/artifacts/ai-controls-matrix
148-227|Endpoint management,Endpoint Inventory,UEM-04,Maintain an inventory of all endpoints used to store and process company data.,https://cloudsecurityalliance.org/artifacts/ai-controls-matrix
148-227|Endpoint management,Endpoint Management,UEM-05,"Define, implement and evaluate processes, procedures and technical measures to enforce policies and controls for all endpoints permitted to access systems and/or store, transmit, or process organizational data.",https://cloudsecurityalliance.org/artifacts/ai-controls-matrix
148-227|Endpoint management,Third-Party Endpoint Security Posture,UEM-14,"Define, implement and evaluate processes, procedures and technical and/or contractual measures to maintain proper security of third-party endpoints with access to organizational assets.",https://cloudsecurityalliance.org/artifacts/ai-controls-matrix
157-430|Protect and clear cached sensitive data,AI Cache Protection,AIS-14,Implement security measures to protect caches in GenAI systems and services.,https://cloudsecurityalliance.org/artifacts/ai-controls-matrix
157-587|Equipment management,Off-Site Equipment Disposal Policy and Procedures,DCS-01,"Establish, document, approve, communicate, apply, evaluate and maintain policies and procedures for the secure disposal of equipment used outside the organization's premises. If the equipment is not physically destroyed a data destruction procedure that renders recovery of information impossible must be applied. Review and update the policies and procedures at least annually, or upon significant changes.",https://cloudsecurityalliance.org/artifacts/ai-controls-matrix
157-587|Equipment management,Off-Site Transfer Authorization Policy and Procedures,DCS-02,"Establish, document, approve, communicate, apply, evaluate and maintain policies and procedures for the relocation or transfer of hardware, software, or data/information to an offsite or alternate location. The relocation or transfer request requires the written or cryptographically verifiable authorization. Review and update the policies and procedures at least annually, or upon significant changes.",https://cloudsecurityalliance.org/artifacts/ai-controls-matrix
157-587|Equipment management,Equipment Identification,DCS-08,Use equipment identification as a method for connection authentication.,https://cloudsecurityalliance.org/artifacts/ai-controls-matrix
157-587|Equipment management,Equipment Location,DCS-15,Keep business-critical equipment away from locations subject to high probability for environmental risk events.,https://cloudsecurityalliance.org/artifacts/ai-controls-matrix
162-655|Documentation of all components' business or security function,Documentation,BCR-05,"Develop, identify, and acquire documentation, both internally and from external parties, that is relevant to support the business continuity and operational resilience programs. Make the documentation available to authorized stakeholders and review at least annually or upon significant changes.",https://cloudsecurityalliance.org/artifacts/ai-controls-matrix
162-655|Documentation of all components' business or security function,SSRM Documentation Review,STA-06,Review and validate SSRM documentation.,https://cloudsecurityalliance.org/artifacts/ai-controls-matrix
172-101|Personnel security,Background Screening Policy and Procedures,HRS-01,"Establish, document, approve, communicate, apply, evaluate and maintain policies and procedures for background verification of all new employees (including but not limited to remote employees, contractors, and third parties) according to local laws, regulations, ethics, and contractual constraints and proportional to the data classification to be accessed, the business requirements, and acceptable risk. Review and update the policies and procedures at least annually.",https://cloudsecurityalliance.org/artifacts/ai-controls-matrix
172-101|Personnel security,Employment Agreement Process,HRS-07,"Employees sign the employee agreement prior to being granted access to organizational information systems, resources and assets.",https://cloudsecurityalliance.org/artifacts/ai-controls-matrix
172-101|Personnel security,Non-Disclosure Agreements,HRS-10,"Identify, document, and review, at planned intervals, requirements for non-disclosure/confidentiality agreements reflecting the organization's needs for the protection of data and operational details.",https://cloudsecurityalliance.org/artifacts/ai-controls-matrix
180-488|Proper Configuration for all applications and frameworks,OS Hardening and Base Controls,I&S-04,"Harden host and guest OS, hypervisor or infrastructure control plane, according to their respective best practices, and supported by technical controls, as part of a security baseline.",https://cloudsecurityalliance.org/artifacts/ai-controls-matrix
202-604|Human AI oversight,Human supervision,GRC-15,"Establish, execute, and assess processes, procedures, and technical measures to ensure human oversight and control of the AI system in compliance with regulatory requirements and organizational risk management.",https://cloudsecurityalliance.org/artifacts/ai-controls-matrix
204-272|Sensitive AI output handling,Output Validation,AIS-09,"Validate, filter, modify or block, as necessary, output against adversarial patterns, failure patterns and unwanted behaviour according to organisational policies and applicable laws and regulations.",https://cloudsecurityalliance.org/artifacts/ai-controls-matrix
217-168|Audit & accountability,Audit and Assurance Policy and Procedures,A&A-01,"Establish, document, approve, communicate, apply, evaluate and maintain audit and assurance policies and procedures and standards. Review and update the policies and procedures at least annually or upon significant changes.",https://cloudsecurityalliance.org/artifacts/ai-controls-matrix
217-168|Audit & accountability,Independent Assessments,A&A-02,Conduct independent audit and assurance assessments according to relevant standards at least annually.,https://cloudsecurityalliance.org/artifacts/ai-controls-matrix
217-168|Audit & accountability,Audit Management Process,A&A-05,"Define and implement an Audit Management process aligned with global auditing standards, to support audit planning, risk analysis, security control assessment, conclusion, remediation schedules, report generation, and review of past reports and supporting evidence.",https://cloudsecurityalliance.org/artifacts/ai-controls-matrix
220-442|Model action privilege minimization,Agents Security Boundaries,AIS-11,Establish security boundaries for agents.,https://cloudsecurityalliance.org/artifacts/ai-controls-matrix
225-553|Organizational AI security controls,Governance Program Policy and Procedures,GRC-01,"Establish, document, approve, communicate, apply, evaluate and maintain policies and procedures for an information governance program, which is sponsored by the leadership of the organization and related to AI systems as well. Review and update the policies and procedures at least annually.",https://cloudsecurityalliance.org/artifacts/ai-controls-matrix
227-045|Identify sensitive data and subject it to a policy,Sensitive Data Protection,DSP-17,"Define and implement, processes, procedures and technical measures to protect sensitive data throughout its lifecycle.",https://cloudsecurityalliance.org/artifacts/ai-controls-matrix
234-282|Physical & environment protection,Secure Area Policy and Procedures,DCS-03,"Establish, document, approve, communicate, apply, evaluate and maintain policies and procedures for maintaining a safe and secure working environment in offices, rooms, and facilities. Review and update the policies and procedures at least annually, or upon significant changes.",https://cloudsecurityalliance.org/artifacts/ai-controls-matrix
234-282|Physical & environment protection,Controlled Physical Access Points,DCS-07,"Design and implement physical security perimeters to safeguard personnel, data, and information systems.",https://cloudsecurityalliance.org/artifacts/ai-controls-matrix
234-282|Physical & environment protection,Secure Area Authorization,DCS-09,"Allow only authorized personnel access to secure areas, with all ingress and egress points restricted, documented, and monitored by physical access control mechanisms. Retain access control records on a periodic basis as deemed appropriate by the organization.",https://cloudsecurityalliance.org/artifacts/ai-controls-matrix
234-282|Physical & environment protection,Surveillance System,DCS-10,"Implement, maintain, and operate datacenter surveillance systems at the external perimeter and at all the ingress and egress points to detect unauthorized ingress and egress attempts.",https://cloudsecurityalliance.org/artifacts/ai-controls-matrix
234-282|Physical & environment protection,Secure Utilities,DCS-14,"Secure, monitor, maintain, and test utilities services for continual effectiveness at planned intervals.",https://cloudsecurityalliance.org/artifacts/ai-controls-matrix
240-464|Contingency planning,Business Continuity Management Policy and Procedures,BCR-01,"Establish, document, approve, communicate, apply, evaluate and maintain business continuity management and operational resilience policies and procedures. Review and update the policies and procedures at least annually, or when significant changes occur that could impact risk exposure.",https://cloudsecurityalliance.org/artifacts/ai-controls-matrix
240-464|Contingency planning,Business Continuity Strategy,BCR-03,"Establish strategies to reduce the impact of business disruptions, and improve resiliency and recovery from business disruptions.",https://cloudsecurityalliance.org/artifacts/ai-controls-matrix
240-464|Contingency planning,Business Continuity Planning,BCR-04,"Establish, document, approve, communicate, apply, evaluate and maintain a business continuity plan based on the results of the operational resilience strategies and capabilities.",https://cloudsecurityalliance.org/artifacts/ai-controls-matrix
240-464|Contingency planning,Business Continuity Exercises,BCR-06,Follow a structured approach to evaluate the effectiveness of the business continuity and operational resilience plans at planned intervals or upon significant changes.,https://cloudsecurityalliance.org/artifacts/ai-controls-matrix
240-464|Contingency planning,Communication,BCR-07,Establish and maintain communication channels with all relevant stakeholders in the course of business continuity and resilience procedures.,https://cloudsecurityalliance.org/artifacts/ai-controls-matrix
247-250|Access control processes,Identity and Access Management Policy and Procedures,IAM-01,"Establish, document, approve, communicate, implement, apply, evaluate and maintain policies and procedures for identity and access management. Review and update the policies and procedures at least annually, or upon significant changes.",https://cloudsecurityalliance.org/artifacts/ai-controls-matrix
257-117|Perform regular backups of important data and test restoration,Backup,BCR-08,"Periodically perform backups. Ensure the confidentiality, integrity and availability of the backup, and verify restoration from backup for resiliency.",https://cloudsecurityalliance.org/artifacts/ai-controls-matrix
"263-184|Automate secure build and deployment, especially with SDI",Secure Application Deployment,AIS-06,"Establish and implement strategies and capabilities for secure, standardized, and compliant application deployment. Automate where possible.",https://cloudsecurityalliance.org/artifacts/ai-controls-matrix
267-031|Protect the availability of resources by providing more to higher-priority processes,Equipment Redundancy,BCR-11,Supplement business-critical equipment with both locally redundant and geographically dispersed equipment located at a reasonable minimum distance in accordance with applicable industry standards.,https://cloudsecurityalliance.org/artifacts/ai-controls-matrix
273-600|Segregate components of differing trust levels,Production and Non-Production Environments,I&S-05,Separate production and non-production environments.,https://cloudsecurityalliance.org/artifacts/ai-controls-matrix
273-600|Segregate components of differing trust levels,Segmentation and Segregation,I&S-06,"Design, develop, deploy and configure applications and infrastructures such that tenant access is appropriately segmented and segregated, monitored and restricted.",https://cloudsecurityalliance.org/artifacts/ai-controls-matrix
276-748|Runtime model integrity controls,Model Integrity Checks,MDS-08,"Regularly calculate and compare checksums using cryptographic hashes of model checkpoints to detect unauthorized modifications. Apply at least annually based on the level of risk, or after any change of hands.",https://cloudsecurityalliance.org/artifacts/ai-controls-matrix
284-521|Enforce additional authorization and segregation of duties,Separation of Duties,IAM-04,Employ the separation of duties principle when implementing information system access.,https://cloudsecurityalliance.org/artifacts/ai-controls-matrix
284-521|Enforce additional authorization and segregation of duties,User Access Review,IAM-08,"Review and revalidate user access for least privilege and separation of duties with a frequency that is commensurated with organizational risk tolerance and at least annually, or upon significant changes.",https://cloudsecurityalliance.org/artifacts/ai-controls-matrix
284-521|Enforce additional authorization and segregation of duties,Segregation of Privileged Access Roles,IAM-09,"Define, implement and evaluate processes, procedures and technical measures for the segregation of privileged access roles.",https://cloudsecurityalliance.org/artifacts/ai-controls-matrix
