CRE 0,MITRE ATLAS|name,MITRE ATLAS|id,MITRE ATLAS|description,MITRE ATLAS|hyperlink
615-744|Protect against directory browsing/discovery attacks,Search Victim-Owned Websites,AML.T0003,"Adversaries may search websites owned by the victim for information that can be used during targeting. Victim-owned websites may contain technical details about their AI-enabled products or services. Victim-owned websites may contain a variety of details, including names of departments/divisions, physical locations, and data about key employees such as names, roles, and contact info. These sites may also have details highlighting business operations and relationships. Adversaries may search victim-owned websites to gather actionable information. This information may help adversaries tailor their attacks (e.g. [Adversarial AI Attacks](/techniques/AML.T0017.000) or [Manual Modification](/techniques/AML.T0043.003)). Information from these sources may reveal opportunities for other forms of reconnaissance (e.g. [Search Open Technical Databases](/techniques/AML.T0000) or [Search Open AI Vulnerability Analysis](/techniques/AML.T0001))",https://atlas.mitre.org/techniques/AML.T0003
615-744|Protect against directory browsing/discovery attacks,Search Open Websites/Domains,AML.T0095,"Adversaries may search public websites and/or domains for information about victims that can be used during targeting. Information about victims may be available in various online sites, such as social media, new sites, or domains owned by the victim. Adversaries may find the information they seek to gather via search engines. They can use precise search queries to identify software platforms or services used by the victim to use in targeting. This may be followed by [Exploit Public-Facing Application](/techniques/AML.T0049) or [Prompt Infiltration via Public-Facing Application](/techniques/AML.T0093).",https://atlas.mitre.org/techniques/AML.T0095
637-021|Watermarking AI models,Generate Deepfakes,AML.T0088,"Adversaries may use generative artificial intelligence (GenAI) to create synthetic media (i.e. imagery, video, audio, and text) that appear authentic. These ""[deepfakes]( https://en.wikipedia.org/wiki/Deepfake)"" may mimic a real person or depict fictional personas. Adversaries may use deepfakes for impersonation to conduct [Phishing](/techniques/AML.T0052) or to evade AI applications such as biometric identity verification systems (see [Evade AI Model](/techniques/AML.T0015)). Manipulation of media has been possible for a long time, however GenAI reduces the skill and level of effort required, allowing adversaries to rapidly scale operations to target more users or systems. It also makes real-time manipulations feasible. Adversaries may utilize open-source models and software that were designed for legitimate use cases to generate deepfakes for malicious use. However, there are some projects specifically tailored towards malicious use cases such as [ProKYC](https://www.catonetworks.com/blog/prokyc-selling-deepfake-tool-for-account-fraud-attacks/).",https://atlas.mitre.org/techniques/AML.T0088
641-760|AI Input distortion,Input Restoration,AML.M0010,Preprocess all inference data to nullify or reverse potential adversarial perturbations.,https://atlas.mitre.org/techniques/AML.M0010
641-760|AI Input distortion,Manual Modification,AML.T0043.003,Adversaries may manually modify the input data to craft adversarial data. They may use their knowledge of the target model to modify parts of the data they suspect helps the model in performing its task. The adversary may use trial and error until they are able to verify they have a working adversarial input.,https://atlas.mitre.org/techniques/AML.T0043.003
663-550|Testing against model theft by inference,Use Pre-Trained Model,AML.T0005.002,Adversaries may use an off-the-shelf pre-trained model as a proxy for the victim model to aid in staging the attack.,https://atlas.mitre.org/techniques/AML.T0005.002
686-110|Direct prompt injection,LLM Prompt Injection,AML.T0051,"An adversary may craft malicious prompts as inputs to an LLM that cause the LLM to act in unintended ways. These ""prompt injections"" are often designed to cause the model to ignore aspects of its original instructions and follow the adversary's instructions instead. Prompt Injections can be an initial access vector to the LLM that provides the adversary with a foothold to carry out other steps in their operation. They may be designed to bypass defenses in the LLM, or allow the adversary to issue privileged commands. The effects of a prompt injection can persist throughout an interactive session with an LLM. Malicious prompts may be injected directly by the adversary ([Direct](/techniques/AML.T0051.000)) either to leverage the LLM to generate harmful content or to gain a foothold on the system and lead to further effects. Prompts may also be injected indirectly when as part of its normal operation the LLM ingests the malicious prompt from another data source ([Indirect](/techniques/AML.T0051.001)). This type of injection can be used by the adversary to a foothold on the system or to target the user of the LLM. Malicious prompts may also be [Triggered](/techniques/AML.T0051.002) user actions or system events.",https://atlas.mitre.org/techniques/AML.T0051
686-110|Direct prompt injection,Direct,AML.T0051.000,"An adversary may inject prompts directly as a user of the LLM. This type of injection may be used by the adversary to gain a foothold in the system or to misuse the LLM itself, as for example to generate harmful content.",https://atlas.mitre.org/techniques/AML.T0051.000
686-110|Direct prompt injection,Prompt Infiltration via Public-Facing Application,AML.T0093,"An adversary may introduce malicious prompts into the victim's system via a public-facing application with the intention of it being ingested by an AI at some point in the future and ultimately having a downstream effect. This may occur when a data source is indexed by a retrieval augmented generation (RAG) system, when a rule triggers an action by an AI agent, or when a user utilizes a large language model (LLM) to interact with the malicious content. The malicious prompts may persist on the victim system for an extended period and could affect multiple users and various AI tools within the victim organization. Any public-facing application that accepts text input could be a target. This includes email, shared document systems like OneDrive or Google Drive, and service desks or ticketing systems like Jira. This also includes OCR-mediated infiltration where malicious instructions are embedded in images, screenshots, and invoices that are ingested into the system. Adversaries may perform [Reconnaissance](/tactics/AML.TA0002) to identify public facing applications that are likely monitored by an AI agent or are likely to be indexed by a RAG. They may perform [Discover AI Agent Configuration](/techniques/AML.T0084) to refine their targeting.",https://atlas.mitre.org/techniques/AML.T0093
701-654|Supply-chain model poisoning,AI Agent Tool,AML.T0010.005,"Adversaries may target AI agent tools as a means to compromise a victim's AI supply chain. Tools add capabilities to AI agents, allowing them to interact with other services, connect to data sources, access internet resources, run system tools, and execute code. They are an attractive target for adversaries because compromising an AI agent can provide them with broad accesses and permissions on the victim's system via the agent's other tools. Poisoned agent tools (See [AI Agent Tool Poisoning](/techniques/AML.T0110)) can contain malicious code or [LLM Prompt Injection](/techniques/AML.T0051)s that manipulate the agent's behavior and even modify how other tools are called. Adversaries have successfully used a poisoned MCP server to exfiltrate private user data [\[5\]][koi]. Agent tools have exploded in popularity, with thousands of MCP servers available publicly [\[2\]][glama]. They are often released on open-source software repositories such as GitHub, indexed on hubs specific to MCP servers [\[3\]][mcp-hub][\[4\]][mcp-server-hub], and published to package registries such as NPM. AI agents can also be connected to remotely-hosted tools [\[5\]][remote-mcp]. This creates an environment where malicious tools can proliferate rapidly and safeguards are often not in place. [koi]: https://www.koi.ai/blog/postmark-mcp-npm-malicious-backdoor-email-theft ""First Malicious MCP in the Wild: The Postmark Backdoor That's Stealing Your Emails"" [glama]: https://glama.ai/mcp/servers ""Glama"" [mcp-hub]: https://www.mcphub.ai/ ""MCP Hub"" [mcp-server-hub]: https://mcpserverhub.com/ ""MCP Server Hub"" [remote-mcp]: https://mcpservers.org/remote-mcp-servers ""Remote MCP Servers""",https://atlas.mitre.org/techniques/AML.T0010.005
701-654|Supply-chain model poisoning,Poisoned AI Agent Tool,AML.T0011.002,"A victim may invoke a poisoned tool when interacting with their AI agent. A poisoned tool may execute an [LLM Prompt Injection](/techniques/AML.T0051) or perform [AI Agent Tool Invocation](/techniques/AML.T0053). Poisoned AI agent tools may be introduced into the victim's environment via [AI Software](/techniques/AML.T0010.001), or the user may configure their agent to connect to remote tools.",https://atlas.mitre.org/techniques/AML.T0011.002
701-654|Supply-chain model poisoning,Publish Poisoned Models,AML.T0058,Adversaries may publish a poisoned model to a public location such as a model registry or code repository. The poisoned model may be a novel model or a poisoned variant of an existing open-source model. This model may be introduced to a victim system via [AI Supply Chain Compromise](/techniques/AML.T0010).,https://atlas.mitre.org/techniques/AML.T0058
715-644|Access control to AI inference,Control Access to AI Models and Data at Rest,AML.M0005,Establish access controls on internal model registries and limit internal access to production models. Limit access to training data only to approved users.,https://atlas.mitre.org/techniques/AML.M0005
715-644|Access control to AI inference,Control Access to AI Models and Data in Production,AML.M0019,Require users to verify their identities before accessing a production model. Require authentication for API endpoints and monitor production model queries to ensure compliance with usage policies and to prevent model misuse.,https://atlas.mitre.org/techniques/AML.M0019
715-644|Access control to AI inference,AI Model Inference API Access,AML.T0040,"Adversaries may gain access to a model via legitimate access to the inference API. Inference API access can be a source of information to the adversary ([Discover AI Model Ontology](/techniques/AML.T0013), [Discover AI Model Family](/techniques/AML.T0014)), a means of staging the attack ([Verify Attack](/techniques/AML.T0042), [Craft Adversarial Data](/techniques/AML.T0043)), or for introducing data to the target system for Impact ([Evade AI Model](/techniques/AML.T0015), [Erode AI Model Integrity](/techniques/AML.T0031)). Many systems rely on the same models provided via an inference API, which means they share the same vulnerabilities. This is especially true of foundation models which are prohibitively resource intensive to train. Adversaries may use their access to model APIs to identify vulnerabilities such as jailbreaks or hallucinations and then target applications that use the same models.",https://atlas.mitre.org/techniques/AML.T0040
715-644|Access control to AI inference,AI-Enabled Product or Service,AML.T0047,Adversaries may use a product or service that uses artificial intelligence under the hood to gain access to the underlying AI model. This type of indirect model access may reveal details of the AI model or its inferences in logs or metadata.,https://atlas.mitre.org/techniques/AML.T0047
732-148|Vulnerability management,Vulnerability Scanning,AML.M0016,"Vulnerability scanning is used to find potentially exploitable software vulnerabilities to remediate them. File formats such as pickle files that are commonly used to store AI models can contain exploits that allow for arbitrary code execution. These files should be scanned for potentially unsafe calls, which could be used to execute code, create new processes, or establish networking capabilities. Adversaries may embed malicious code in model corrupt model files, so scanners should be capable of working with models that cannot be fully de-serialized. Model artifacts, downstream products produced by models, and external software dependencies should be scanned for known vulnerabilities.",https://atlas.mitre.org/techniques/AML.M0016
732-148|Vulnerability management,Search Open AI Vulnerability Analysis,AML.T0001,"Much like the [Search Open Technical Databases](/techniques/AML.T0000), there is often ample research available on the vulnerabilities of common AI models. Once a target has been identified, an adversary will likely try to identify any pre-existing work that has been done for this class of models. This will include not only reading academic papers that may identify the particulars of a successful attack, but also identifying pre-existing implementations of those attacks. The adversary may obtain [Adversarial AI Attack Implementations](/techniques/AML.T0016.000) or develop their own [Adversarial AI Attacks](/techniques/AML.T0017.000) if necessary.",https://atlas.mitre.org/techniques/AML.T0001
732-148|Vulnerability management,Exploit Public-Facing Application,AML.T0049,"Adversaries may attempt to take advantage of a weakness in an Internet-facing computer or program using software, data, or commands in order to cause unintended or unanticipated behavior. The weakness in the system can be a bug, a glitch, or a design vulnerability. These applications are often websites, but can include databases (like SQL), standard services (like SMB or SSH), network device administration and management protocols (like SNMP and Smart Install), and any other applications with Internet accessible open sockets, such as web servers and related services.",https://atlas.mitre.org/techniques/AML.T0049
732-148|Vulnerability management,Drive-by Compromise,AML.T0078,"Adversaries may gain access to an AI system through a user visiting a website over the normal course of browsing, or an AI agent retrieving information from the web on behalf of a user. Websites can contain an [LLM Prompt Injection](/techniques/AML.T0051) which, when executed, can change the behavior of the AI model. The same approach may be used to deliver other types of malicious code that don't target AI directly (See [Drive-by Compromise in ATT&CK](https://attack.mitre.org/techniques/T1189/)).",https://atlas.mitre.org/techniques/AML.T0078
803-457|Protection against AI-Specfic Threats,Adversarial AI Attack Implementations,AML.T0016.000,"Adversaries may search for existing open source implementations of AI attacks. The research community often publishes their code for reproducibility and to further future research. Libraries intended for research purposes, such as CleverHans, the Adversarial Robustness Toolbox, and FoolBox, can be weaponized by an adversary. Adversaries may also obtain and use tools that were not originally designed for adversarial AI attacks as part of their attack.",https://atlas.mitre.org/techniques/AML.T0016.000
818-434|Protection of technical AI information,Limit Public Release of Information,AML.M0000,"Limit the public release of technical information about the AI stack used in an organization's products or services. Technical knowledge of how AI is used can be leveraged by adversaries to perform targeting and tailor attacks to the target system. Additionally, consider limiting the release of organizational information - including physical locations, researcher names, and department structures - from which technical details such as AI techniques, model architectures, or datasets may be inferred.",https://atlas.mitre.org/techniques/AML.M0000
818-434|Protection of technical AI information,Limit Model Artifact Release,AML.M0001,"Limit public release of technical project details including data, algorithms, model architectures, and model checkpoints that are used in production, or that are representative of those used in production.",https://atlas.mitre.org/techniques/AML.M0001
818-434|Protection of technical AI information,Search Open Technical Databases,AML.T0000,"Adversaries may search for publicly available research and technical documentation to learn how and where AI is used within a victim organization. The adversary can use this information to identify targets for attack, or to tailor an existing attack to make it more effective. Organizations often use open source model architectures trained on additional proprietary data in production. Knowledge of this underlying architecture allows the adversary to craft more realistic proxy models ([Create Proxy AI Model](/techniques/AML.T0005)). An adversary can search these resources for publications for authors employed at the victim organization. Research and technical materials may exist as academic papers published in [Journals and Conference Proceedings](/techniques/AML.T0000.000), or stored in [Pre-Print Repositories](/techniques/AML.T0000.001), as well as [Technical Blogs](/techniques/AML.T0000.002).",https://atlas.mitre.org/techniques/AML.T0000
818-434|Protection of technical AI information,Journals and Conference Proceedings,AML.T0000.000,"Many of the publications accepted at premier artificial intelligence conferences and journals come from commercial labs. Some journals and conferences are open access, others may require paying for access or a membership. These publications will often describe in detail all aspects of a particular approach for reproducibility. This information can be used by adversaries to implement the paper.",https://atlas.mitre.org/techniques/AML.T0000.000
818-434|Protection of technical AI information,Pre-Print Repositories,AML.T0000.001,"Pre-Print repositories, such as arXiv, contain the latest academic research papers that haven't been peer reviewed. They may contain research notes, or technical reports that aren't typically published in journals or conference proceedings. Pre-print repositories also serve as a central location to share papers that have been accepted to journals. Searching pre-print repositories provide adversaries with a relatively up-to-date view of what researchers in the victim organization are working on.",https://atlas.mitre.org/techniques/AML.T0000.001
818-434|Protection of technical AI information,Technical Blogs,AML.T0000.002,"Research labs at academic institutions and company R&D divisions often have blogs that highlight their use of artificial intelligence and its application to the organization's unique problems. Individual researchers also frequently document their work in blogposts. An adversary may search for posts made by the target victim organization or its employees. In comparison to [Journals and Conference Proceedings](/techniques/AML.T0000.000) and [Pre-Print Repositories](/techniques/AML.T0000.001) this material will often contain more practical aspects of the AI system. This could include underlying technologies and frameworks used, and possibly some information about the API access and use case. This will help the adversary better understand how that organization is using AI internally and the details of their approach that could aid in tailoring an attack.",https://atlas.mitre.org/techniques/AML.T0000.002
818-434|Protection of technical AI information,Search Application Repositories,AML.T0004,"Adversaries may search open application repositories during targeting. Examples of these include Google Play, the iOS App store, the macOS App Store, and the Microsoft Store. Adversaries may craft search queries seeking applications that contain AI-enabled components. Frequently, the next step is to [Acquire Public AI Artifacts](/techniques/AML.T0002).",https://atlas.mitre.org/techniques/AML.T0004
818-434|Protection of technical AI information,Discover LLM System Information,AML.T0069,"The adversary is trying to discover something about the large language model's (LLM) system information. This may be found in a configuration file containing the system instructions or extracted via interactions with the LLM. The desired information may include the full system prompt, special characters that have significance to the LLM or keywords indicating functionality available to the LLM. Information about how the LLM is instructed can be used by the adversary to understand the system's capabilities and to aid them in crafting malicious prompts.",https://atlas.mitre.org/techniques/AML.T0069
818-434|Protection of technical AI information,Discover AI Agent Configuration,AML.T0084,"Adversaries may attempt to discover configuration information for AI agents present on the victim's system. Agent configurations can include tools or services they have access to. Adversaries may directly access agent configuring dashboards or configuration files. They may also obtain configuration details by prompting the agent with questions such as ""What tools do you have access to?"" Adversaries can use the information they discover about AI agents to help with targeting.",https://atlas.mitre.org/techniques/AML.T0084
818-434|Protection of technical AI information,Tool Definitions,AML.T0084.001,"Adversaries may discover the tools the AI agent has access to. By identifying which tools are available, the adversary can understand what actions may be executed through the agent and what additional resources it can reach. This knowledge may reveal access to external data sources such as OneDrive or SharePoint, or expose exfiltration paths like the ability to send emails, helping adversaries identify AI agents that provide the greatest value or opportunity for attack.",https://atlas.mitre.org/techniques/AML.T0084.001
818-434|Protection of technical AI information,Activation Triggers,AML.T0084.002,"Adversaries may discover keywords or other triggers (such as incoming emails, documents being added, incoming message, or other workflows) that activate an agent and may cause it to run additional actions. Understanding these triggers can reveal how the AI agent is activated and controlled. This may also expose additional paths for compromise, as an adversary could attempt to trigger the agent from outside its environment and drive it to perform unintended or malicious actions.",https://atlas.mitre.org/techniques/AML.T0084.002
834-645|Avoid unauthorized client data collection,Gather Victim Identity Information,AML.T0087,"Adversaries may gather information about the victim's identity that can be used during targeting. Information about identities may include a variety of details, including personal data (ex: employee names, email addresses, photos, etc.) as well as sensitive details such as credentials or multi-factor authentication (MFA) configurations. Adversaries may gather this information in various ways, such as direct elicitation, [Search Victim-Owned Websites](/techniques/AML.T0003), or via leaked information on the black market. Adversaries may use the gathered victim data to Create Deepfakes and impersonate them in a convincing manner. This may create opportunities for adversaries to [Establish Accounts](/techniques/AML.T0021) under the impersonated identity, or allow them to perform convincing [Phishing](/techniques/AML.T0052) attacks.",https://atlas.mitre.org/techniques/AML.T0087
852-770|AI model supply chain management,Model,AML.T0010.003,"AI-enabled systems often rely on open sourced models in various ways. Most commonly, the victim organization may be using these models for fine tuning. These models will be downloaded from an external source and then used as the base for the model as it is tuned on a smaller, private dataset. Loading models often requires executing some saved code in the form of a saved model file. These can be compromised with traditional malware, or through some adversarial AI techniques.",https://atlas.mitre.org/techniques/AML.T0010.003
857-718|Protect against OS command injection attack,Command and Scripting Interpreter,AML.T0050,"Adversaries may abuse command and script interpreters to execute commands, scripts, or binaries. These interfaces and languages provide ways of interacting with computer systems and are a common feature across many different platforms. Most systems come with some built-in command-line interface and scripting capabilities, for example, macOS and Linux distributions include some flavor of Unix Shell while Windows installations include the Windows Command Shell and PowerShell. There are also cross-platform interpreters such as Python, as well as those commonly associated with client applications such as JavaScript and Visual Basic. Adversaries may abuse these technologies in various ways as a means of executing arbitrary commands. Commands and scripts can be embedded in Initial Access payloads delivered to victims as lure documents or as secondary payloads downloaded from an existing C2. Adversaries may also execute commands through interactive terminals/shells, as well as utilize various Remote Services in order to achieve remote Execution.",https://atlas.mitre.org/techniques/AML.T0050
