CRE 0,MITRE ATLAS|name,MITRE ATLAS|id,MITRE ATLAS|description,MITRE ATLAS|hyperlink
220-442|Model action privilege minimization,AI Agent,AML.T0108,"Adversaries may abuse AI agents present on the victim's system for command and control. AI agents are often granted access to tools that can execute shell commands, reach out to the internet, and interact with other services in the victim's environment, making them capable C2 agents. The adversary may modify the behavior of an AI agent for C2 via [LLM Prompt Injection](/techniques/AML.T0051) and rely on the agent's ability to invoke tools to retrieve and execute the adversary's commands. They may maintain persistent control of an agent via [Modify AI Agent Configuration](/techniques/AML.T0081) or [AI Agent Context Poisoning](/techniques/AML.T0080). They may instruct the agent to not report their actions to the user in an attempt to remain covert.",https://atlas.mitre.org/techniques/AML.T0108
220-442|Model action privilege minimization,Local AI Agent,AML.T0112.000,"Adversaries may achieve full system compromise by abusing AI agents running locally on a host, such as computer-use agents or AI-driven browsers. These agents are designed to autonomously interact with the operating system, applications, and external services, often with broad permissions to execute commands, access files, manage credentials, and control user workflows. If an adversary is able to take control of an AI agent's behavior, they effectively gain the same level of access as the agent. This can result in complete control over the machine, including executing arbitrary code, accessing or exfiltrating sensitive data, modifying system configurations, and establishing persistence.",https://atlas.mitre.org/techniques/AML.T0112.000
230-318|AI resource exhaustion attack,Denial of AI Service,AML.T0029,"Adversaries may target AI-enabled systems with a flood of requests for the purpose of degrading or shutting down the service. Since many AI systems require significant amounts of specialized compute, they are often expensive bottlenecks that can become overloaded. Adversaries can intentionally craft inputs that require heavy amounts of useless compute from the AI system.",https://atlas.mitre.org/techniques/AML.T0029
234-282|Physical & environment protection,Physical Countermeasures,AML.T0008.003,"Adversaries may acquire or manufacture physical countermeasures to aid or support their attack. These components may be used to disrupt or degrade the model, such as adversarial patterns printed on stickers or T-shirts, disguises, or decoys. They may also be used to disrupt or degrade the sensors used in capturing data, such as laser pointers, light bulbs, or other tools.",https://atlas.mitre.org/techniques/AML.T0008.003
234-282|Physical & environment protection,Physical Environment Access,AML.T0041,"In addition to the attacks that take place purely in the digital domain, adversaries may also exploit the physical environment for their attacks. If the model is interacting with data collected from the real world in some way, the adversary can influence the model through access to wherever the data is being collected. By modifying the data in the collection process, the adversary can perform modified versions of attacks designed for digital access.",https://atlas.mitre.org/techniques/AML.T0041
267-786|Model confidentiality threats,Acquire Public AI Artifacts,AML.T0002,"Adversaries may search public sources, including cloud storage, public-facing services, and software or data repositories, to identify AI artifacts. These AI artifacts may include the software stack used to train and deploy models, training and testing data, model configurations and parameters. An adversary will be particularly interested in artifacts hosted by or associated with the victim organization as they may represent what that organization uses in a production environment. Adversaries may identify artifact repositories via other resources associated with the victim organization (e.g. [Search Victim-Owned Websites](/techniques/AML.T0003) or [Search Open Technical Databases](/techniques/AML.T0000)). These AI artifacts often provide adversaries with details of the AI task and approach. AI artifacts can aid in an adversary's ability to [Create Proxy AI Model](/techniques/AML.T0005). If these artifacts include pieces of the actual model in production, they can be used to directly [Craft Adversarial Data](/techniques/AML.T0043). Acquiring some artifacts requires registration (providing user details such email/name), AWS keys, or written requests, and may require the adversary to [Establish Accounts](/techniques/AML.T0021). Artifacts might be hosted on victim-controlled infrastructure, providing the victim with some information on who has accessed that data.",https://atlas.mitre.org/techniques/AML.T0002
267-786|Model confidentiality threats,Models,AML.T0002.001,"Adversaries may acquire public models to use in their operations. Adversaries may seek models used by the victim organization or models that are representative of those used by the victim organization. Representative models may include model architectures, or pre-trained models which define the architecture as well as model parameters from training on a dataset. The adversary may search public sources for common model architecture configuration file formats such as YAML or Python configuration files, and common model storage file formats such as ONNX (.onnx), HDF5 (.h5), Pickle (.pkl), PyTorch (.pth), or TensorFlow (.pb, .tflite). Acquired models are useful in advancing the adversary's operations and are frequently used to tailor attacks to the victim model.",https://atlas.mitre.org/techniques/AML.T0002.001
267-786|Model confidentiality threats,Discover AI Artifacts,AML.T0007,"Adversaries may search private sources to identify AI learning artifacts that exist on the system and gather information about them. These artifacts can include the software stack used to train and deploy models, training and testing data management systems, container registries, software repositories, and model zoos. This information can be used to identify targets for further collection, exfiltration, or disruption, and to tailor and improve attacks.",https://atlas.mitre.org/techniques/AML.T0007
267-786|Model confidentiality threats,AI Artifact Collection,AML.T0035,Adversaries may collect AI artifacts for [Exfiltration](/tactics/AML.TA0010) or for use in [AI Attack Staging](/tactics/AML.TA0001). AI artifacts include models and datasets as well as other telemetry data produced when interacting with a model.,https://atlas.mitre.org/techniques/AML.T0035
276-748|Runtime model integrity controls,Manipulate AI Model,AML.T0018,"Adversaries may directly manipulate an AI model to change its behavior or introduce malicious code. Manipulating a model gives the adversary a persistent change in the system. This can include poisoning the model by changing its weights, modifying the model architecture to change its behavior, and embedding malware which may be executed when the model is loaded.",https://atlas.mitre.org/techniques/AML.T0018
276-748|Runtime model integrity controls,Modify AI Model Architecture,AML.T0018.001,"Adversaries may directly modify an AI model's architecture to re-define it's behavior. This can include adding or removing layers as well as adding pre or post-processing operations. The effects could include removing the ability to predict certain classes, adding erroneous operations to increase computation costs, or degrading performance. Additionally, a separate adversary-defined network could be injected into the computation graph, which can change the behavior based on the inputs, effectively creating a backdoor.",https://atlas.mitre.org/techniques/AML.T0018.001
276-748|Runtime model integrity controls,Corrupt AI Model,AML.T0076,An adversary may purposefully corrupt a malicious AI model file so that it cannot be successfully deserialized in order to evade detection by a model scanner. The corrupt model may still successfully execute malicious code before deserialization fails.,https://atlas.mitre.org/techniques/AML.T0076
307-507|Allow only trusted sources both build time and runtime; therefore perform integrity checks on all resources and code,Code Signing,AML.M0013,Enforce binary and application integrity with digital signature verification to prevent untrusted code from executing. Adversaries can embed malicious code in AI software or models. Developers should also cryptographically sign SBOM and AIBOM components that track model or data provenance. Enforcement of code signing can prevent the compromise of the AI supply chain and prevent execution of malicious code.,https://atlas.mitre.org/techniques/AML.M0013
308-515|Prevent security disclosure,Cloud Service Discovery,AML.T0075,"Adversaries may attempt to enumerate the cloud services running on a system after gaining access. These methods can differ from platform-as-a-service (PaaS), to infrastructure-as-a-service (IaaS), software-as-a-service (SaaS), or AI-as-a-service (AIaaS). Many services exist throughout the various cloud providers and can include Continuous Integration and Continuous Delivery (CI/CD), Lambda Functions, Entra ID, AI Inference, Generative AI, Agentic AI, etc. They may also include security services, such as AWS GuardDuty and Microsoft Defender for Cloud, and logging services, such as AWS CloudTrail and Google Cloud Audit Logs. Adversaries may attempt to discover information about the services enabled throughout the environment. Azure tools and APIs, such as the Microsoft Graph API and Azure Resource Manager API, can enumerate resources and services, including applications, management groups, resources and policy definitions, and their relationships that are accessible by an identity. They may use tools to check credentials and enumerate the AI models available in various AIaaS providers' environments including AI21 Labs, Anthropic, AWS Bedrock, Azure, ElevenLabs, MakerSuite, Mistral, OpenAI, OpenRouter, and GCP Vertex AI [\[1\]][1]. [1]: https://www.sysdig.com/blog/llmjacking-stolen-cloud-credentials-used-in-new-ai-attack",https://atlas.mitre.org/techniques/AML.T0075
308-515|Prevent security disclosure,Process Discovery,AML.T0089,"Adversaries may attempt to get information about processes running on a system. Once obtained, this information could be used to gain an understanding of common AI-related software/applications running on systems within the network. Administrator or otherwise elevated access may provide better process details. Identifying the AI software stack can then lead an adversary to new targets and attack pathways. AI-related software may require application tokens to authenticate with backend services. This provides opportunities for [Credential Access](/tactics/AML.TA0013) and [Lateral Movement](/tactics/AML.TA0015). In Windows environments, adversaries could obtain details on running processes using the Tasklist utility via cmd or `Get-Process` via PowerShell. Information about processes can also be extracted from the output of Native API calls such as `CreateToolhelp32Snapshot`. In Mac and Linux, this is accomplished with the `ps` command. Adversaries may also opt to enumerate processes via `/proc`.",https://atlas.mitre.org/techniques/AML.T0089
333-480|Impact limitation of unwanted model behaviour,Generative AI Guardrails,AML.M0020,"Guardrails are safety controls that are placed between a generative AI model and the output shared with the user to prevent undesired inputs and outputs. Guardrails can take the form of validators such as filters, rule-based logic, or regular expressions, as well as AI-based approaches, such as classifiers and utilizing LLMs, or named entity recognition (NER) to evaluate the safety of the prompt or response. Domain specific methods can be employed to reduce risks in a variety of areas such as etiquette, brand damage, jailbreaking, false information, code exploits, SQL injections, and data leakage.",https://atlas.mitre.org/techniques/AML.M0020
333-480|Impact limitation of unwanted model behaviour,Generative AI Guidelines,AML.M0021,"Guidelines are safety controls that are placed between user-provided input and a generative AI model to help direct the model to produce desired outputs and prevent undesired outputs. Guidelines can be implemented as instructions appended to all user prompts or as part of the instructions in the system prompt. They can define the goal(s), role, and voice of the system, as well as outline safety and security parameters.",https://atlas.mitre.org/techniques/AML.M0021
342-641|Anomalous AI input handling,Adversarial Input Detection,AML.M0015,"Detect and block adversarial inputs or atypical queries that deviate from known benign behavior, exhibit behavior patterns observed in previous attacks or that come from potentially malicious IPs. Incorporate adversarial detection algorithms into the AI system prior to the AI model.",https://atlas.mitre.org/techniques/AML.M0015
370-877|Evasion (e.g. adversarial examples),Evade AI Model,AML.T0015,Adversaries can [Craft Adversarial Data](/techniques/AML.T0043) that prevents an AI model from correctly identifying the contents of the data or [Generate Deepfakes](/techniques/AML.T0088) that fools an AI model expecting authentic data. This technique can be used to evade a downstream task where AI is utilized. The adversary may evade AI-based virus/malware detection or network scanning towards the goal of a traditional cyber attack. AI model evasion through deepfake generation may also provide initial access to systems that use AI-based biometric authentication.,https://atlas.mitre.org/techniques/AML.T0015
370-877|Evasion (e.g. adversarial examples),Craft Adversarial Data,AML.T0043,"Adversarial data are inputs to an AI model that have been modified such that they cause the adversary's desired effect in the target model. Effects can range from misclassification, to missed detections, to maximizing energy consumption. Typically, the modification is constrained in magnitude or location so that a human still perceives the data as if it were unmodified, but human perceptibility may not always be a concern depending on the adversary's intended effect. For example, an adversarial input for an image classification task is an image the AI model would misclassify, but a human would still recognize as containing the correct class. Depending on the adversary's knowledge of and access to the target model, the adversary may use different classes of algorithms to develop the adversarial example such as [White-Box Optimization](/techniques/AML.T0043.000), [Black-Box Optimization](/techniques/AML.T0043.001), [Black-Box Transfer](/techniques/AML.T0043.002), or [Manual Modification](/techniques/AML.T0043.003). The adversary may [Verify Attack](/techniques/AML.T0042) their approach works if they have white-box or inference API access to the model. This allows the adversary to gain confidence their attack is effective ""live"" environment where their attack may be noticed. They can then use the attack at a later time to accomplish their goals. An adversary may optimize adversarial examples for [Evade AI Model](/techniques/AML.T0015), or to [Erode AI Model Integrity](/techniques/AML.T0031).",https://atlas.mitre.org/techniques/AML.T0043
370-877|Evasion (e.g. adversarial examples),Exploitation for Defense Evasion,AML.T0107,"Adversaries may exploit a system or application vulnerability to bypass security features. Exploitation of a vulnerability occurs when an adversary takes advantage of a programming error in a program, service, or within the operating system software or kernel itself to execute adversary-controlled code. Vulnerabilities may exist in defensive security software that can be used to disable or circumvent them.",https://atlas.mitre.org/techniques/AML.T0107
423-055|Data supply chain management,AI Bill of Materials,AML.M0023,"An AI Bill of Materials (AI BOM) contains a full listing of artifacts and resources that were used in building the AI. The AI BOM can help mitigate supply chain risks and enable rapid response to reported vulnerabilities. This can include maintaining dataset provenance, i.e. a detailed history of datasets used for AI applications. The history can include information about the dataset source as well as well as a complete record of any modifications.",https://atlas.mitre.org/techniques/AML.M0023
423-055|Data supply chain management,Maintain AI Dataset Provenance,AML.M0025,Maintain a detailed history of datasets used for AI applications. The history should include information about the dataset's source as well as a complete record of any modifications.,https://atlas.mitre.org/techniques/AML.M0025
423-055|Data supply chain management,Data,AML.T0010.002,Data is a key vector of supply chain compromise for adversaries. Every AI project will require some form of data. Many rely on large open source datasets that are publicly available. An adversary could rely on compromising these sources of data. The malicious data could be a result of [Poison Training Data](/techniques/AML.T0020) or include traditional malware. An adversary can also target private datasets in the labeling phase. The creation of private datasets will often require the hiring of outside labeling services. An adversary can poison a dataset by modifying the labels being generated by the labeling service.,https://atlas.mitre.org/techniques/AML.T0010.002
436-325|AI impact reduction controls,External Harms,AML.T0048,"Adversaries may abuse their access to a victim system and use its resources or capabilities to further their goals by causing harms external to that system. These harms could affect the organization (e.g. Financial Harm, Reputational Harm), its users (e.g. User Harm), or the general public (e.g. Societal Harm).",https://atlas.mitre.org/techniques/AML.T0048
436-325|AI impact reduction controls,Reputational Harm,AML.T0048.001,Reputational harm involves a degradation of public perception and trust in organizations. Examples of reputation-harming incidents include scandals or false impersonations.,https://atlas.mitre.org/techniques/AML.T0048.001
436-325|AI impact reduction controls,Societal Harm,AML.T0048.002,Societal harms might generate harmful outcomes that reach either the general public or specific vulnerable groups such as the exposure of children to vulgar content.,https://atlas.mitre.org/techniques/AML.T0048.002
436-325|AI impact reduction controls,User Harm,AML.T0048.003,User harms may encompass a variety of harm types including financial and reputational that are directed at or felt by individual victims of the attack rather than at the organization level.,https://atlas.mitre.org/techniques/AML.T0048.003
481-710|AI model poisoning,Poison AI Model,AML.T0018.000,"Adversaries may manipulate an AI model's weights to change it's behavior or performance, resulting in a poisoned model. Adversaries may poison a model by directly manipulating its weights, training the model on poisoned data, further fine-tuning the model, or otherwise interfering with its training process. The change in behavior of poisoned models may be limited to targeted categories in predictive AI models, or targeted topics, concepts, or facts in generative AI models, or aim for a general performance degradation.",https://atlas.mitre.org/techniques/AML.T0018.000
481-710|AI model poisoning,Insert Backdoor Trigger,AML.T0043.004,The adversary may add a perceptual trigger into inference data. The trigger may be imperceptible or non-obvious to humans. This technique is used in conjunction with [Poison AI Model](/techniques/AML.T0018.000) and allows the adversary to produce their desired effect in the target model.,https://atlas.mitre.org/techniques/AML.T0043.004
486-813|Configuration,Modify AI Agent Configuration,AML.T0081,"Adversaries may modify the configuration files for AI agents on a system. This allows malicious changes to persist beyond the life of a single agent and affects any agents that share the configuration. Configuration changes may include modifications to the system prompt, tampering with or replacing knowledge sources, modification to settings of connected tools, and more. Through those changes, an attacker could redirect outputs or tools to malicious services, embed covert instructions that exfiltrate data, or weaken security controls that normally restrict agent behavior. Adversaries may modify or disable a configuration setting related to security controls, such as those that would prevent the AI Agent from taking actions that may be harmful to the user's system without human-in-the-loop oversight. Disabling AI agent security features may allow adversaries to achieve their malicious goals and maintain long-term corruption of the AI agent.",https://atlas.mitre.org/techniques/AML.T0081
503-455|Input and output protection,Input and Output Validation for AI Agent Components,AML.M0033,"Implement validation on inputs and outputs for the tools and data sources used by AI agents. Validation includes enforcing a common data format, schema validation, checks for sensitive or prohibited information leakage, and data sanitization to remove potential injections or unsafe code. Input and output validation can help prevent compromises from spreading in AI-enabled systems and can help secure the workflow when multiple components are chained together. Validation should be performed external to the AI agent.",https://atlas.mitre.org/techniques/AML.M0033
"515-021|Sandbox, containerize and/or isolate applications at the network level",Segmentation of AI Agent Components,AML.M0032,"Define security boundaries around agentic tools and data sources with methods such as API access, container isolation, code execution sandboxing, and rate limiting of tool invocation. When sandboxing, limit resource and network access and build the container or virtual machine from a clean base image before each run. This restricts untrusted processes or potential compromises from spreading throughout the system.",https://atlas.mitre.org/techniques/AML.M0032
533-635|AI security Education,User Training,AML.M0018,Educate AI model developers to on AI supply chain risks and potentially malicious AI artifacts. Educate users on how to identify deepfakes and phishing attempts.,https://atlas.mitre.org/techniques/AML.M0018
547-824|AI model performance validation,Validate AI Model,AML.M0008,"Validate that AI models perform as intended by testing for backdoor triggers, potential for data leakage, or adversarial influence. Monitor AI model for concept drift and training data drift, which may indicate data tampering and poisoning.",https://atlas.mitre.org/techniques/AML.M0008
615-663|Data poisoning of train/finetune/augmentation data,Publish Poisoned Datasets,AML.T0019,Adversaries may [Poison Training Data](/techniques/AML.T0020) and publish it to a public location. The poisoned dataset may be a novel dataset or a poisoned variant of an existing open source dataset. This data may be introduced to a victim system via [AI Supply Chain Compromise](/techniques/AML.T0010).,https://atlas.mitre.org/techniques/AML.T0019
615-663|Data poisoning of train/finetune/augmentation data,Poison Training Data,AML.T0020,Adversaries may attempt to poison datasets used by an AI model by modifying the underlying data or its labels. This allows the adversary to embed vulnerabilities in AI models trained on the data that may not be easily detectable. Data poisoning attacks may or may not require modifying the labels. The embedded vulnerability is activated at a later time by data samples with an [Insert Backdoor Trigger](/techniques/AML.T0043.004) Poisoned data can be introduced via [AI Supply Chain Compromise](/techniques/AML.T0010) or the data may be poisoned after the adversary gains [Initial Access](/tactics/AML.TA0004) to the system.,https://atlas.mitre.org/techniques/AML.T0020
615-663|Data poisoning of train/finetune/augmentation data,Erode Dataset Integrity,AML.T0059,"Adversaries may poison or manipulate portions of a dataset to reduce its usefulness, reduce trust, and cause users to waste resources correcting errors.",https://atlas.mitre.org/techniques/AML.T0059
615-663|Data poisoning of train/finetune/augmentation data,RAG Poisoning,AML.T0070,"Adversaries may inject malicious content into data indexed by a retrieval augmented generation (RAG) system to contaminate a future thread through RAG-based search results. This may be accomplished by placing manipulated documents in a location the RAG indexes (see [Gather RAG-Indexed Targets](/techniques/AML.T0064)). The content may be targeted such that it would always surface as a search result for a specific user query. The adversary's content may include false or misleading information. It may also include prompt injections with malicious instructions, or false RAG entries.",https://atlas.mitre.org/techniques/AML.T0070
